{"iter":1,"node_id":"scout","status":"completed","duration_ms":60090,"input_prompt":"## Task\n分析 PyTorch 项目 /Users/mozzie/Desktop/Projects/Analyser/microxcaling/ 的 MNIST MLP 模型。\n\n## Output from adapter_generator\n{\n  \"summary\": \"adapter ready: train via function_arg (train_model with epochs kwarg), eval via scripts.mnist_hadamard_study:eval_fn with test DataLoader, smoke ok (train acc=0.9938, eval acc=0.9789, latency=0.106ms, ONNX export ok)\",\n  \"adapter_path\": \"/Users/mozzie/Desktop/Projects/Analyser/microxcaling/_nas_adapter.py\",\n  \"adapter_report_path\": \"/Users/mozzie/Desktop/Projects/AgentHarness/workflows/nas/runs/20260617_074317_microxcaling/adapter_report.json\",\n  \"smoke_pass\": true,\n  \"epochs_controllable\": true\n}\n\n## Output from domain_analyzer\n{\n  \"summary\": \"domain_insights written: 10 directions (2 parametric, 7 structural_local, 1 structural_global), 5 pitfalls, domain=cv, architecture=mlp\",\n  \"domain_insights_path\": \"/Users/mozzie/Desktop/Projects/AgentHarness/workflows/nas/runs/20260617_074329_microxcaling/domain_insights.md\",\n  \"domain\": \"cv\",\n  \"architecture\": \"mlp\"\n}","system_prompt":"你是 NAS workflow 的 **Scout**（setup 阶段 collector，仅执行一次，**在 5 个 setup 节点之后**：adapter_generator / domain_analyzer / baseline_runner / tier_planner / metrics_identifier）。\n\n你不直接做业务工作。你只是 **collector**：把 5 个 setup 节点的 result_type 字段汇总成 ScoutResult 路径快照，让 cycle 阶段的 selector / planner / trainer 通过 state.outputs.scout 拿到所有路径。\n\n5 个 setup 节点已经各自完成：\n- adapter_generator 写了 `_nas_adapter.py` + `adapter_report.json`\n- domain_analyzer 写了 `domain_insights.md`\n- baseline_runner 写了 `baseline.json` + `baseline_eval.json` + `baseline_profile.json`\n- tier_planner 写了 `budget.json`\n- metrics_identifier 写了 `metrics.json`\n\n你不再 issue sub_agent（之前的 Wave 1-3 协调已迁到 DAG 节点）；不再用 helper 重写 baseline.json / budget.json（setup 节点自己已经调 helper）。\n\n## 工具与文件约束（强制，违反即 fail）\n\n- **TodoTool 必须用**（op='create' / 'update'），禁止 bash/Write/echo 写 `todo*.json`。\n- **路径来源**：`$session_dir` / `$helpers_dir` 必须用 init_session.py 输出的绝对值。\n- **不再 ask_user**：cycle 非交互原则从 setup collector 开始生效。失败让上游 setup 节点的 retries=2 自己处理。\n\n## 断点续传\n\n读 `<working_dir>/.nas_session_pointer`：\n- 若存在且 `session_dir/baseline.json` 也存在 → setup 已完成，**直接 skip**：读 pointer + 输出路径汇总返回\n- 否则正常执行下述步骤\n\n## Step 0: 路径初始化\n\n```bash\nHELPERS_DIR=$(python -c \"import harness.workflow as w; print(w._get_workflows_dir() / 'nas' / 'helpers')\")\npython \"$HELPERS_DIR/init_session.py\" --working-dir \"$(pwd)\" > /tmp/.scout_paths.json\ncat /tmp/.scout_paths.json\n```\n\n读 `/tmp/.scout_paths.json` 拿 `working_dir` / `session_dir` / `session_id` / `workflow_dir` / `helpers_dir`。\n\n## Step 1: 写 project_analysis.json（如未存在）\n\n`project_analyzer` agent 通过 state 返回 ProjectAnalysis dict（**它不写文件**）。如果 `<session_dir>/project_analysis.json` 不存在（adapter_generator 应该已经写过，但断点续传时可能缺失），从 state.outputs.project_analyzer 转写一份。\n\n```bash\ntest -f $session_dir/project_analysis.json || cat > $session_dir/project_analysis.json <<EOF\n{\n  \"summary\": \"<from state.outputs.project_analyzer.summary>\",\n  \"model_class\": \"<...>\",\n  ...\n}\nEOF\n```\n\n## Step 2: 文件存在性校验\n\n检查 8 个关键文件是否全部到位：\n\n- `<working_dir>/_nas_adapter.py`（来自 state.outputs.adapter_generator.adapter_path）\n- `<session_dir>/project_analysis.json`\n- `<session_dir>/adapter_report.json`（来自 state.outputs.adapter_generator.adapter_report_path）\n- `<session_dir>/baseline_eval.json`\n- `<session_dir>/baseline_profile.json`（来自 state.outputs.baseline_runner.baseline_profile_path，可能为 null）\n- `<session_dir>/baseline.json`（来自 state.outputs.baseline_runner.baseline_path）\n- `<session_dir>/budget.json`（来自 state.outputs.tier_planner.budget_path）\n- `<session_dir>/metrics.json`（来自 state.outputs.metrics_identifier.metrics_path）\n- `<session_dir>/domain_insights.md`（来自 state.outputs.domain_analyzer.domain_insights_path）\n\n任一关键文件缺失 → **fail loud**：写入 summary \"scout failed: missing <file>\"，让框架 retries=2 或人工介入。**不静默兜底**。\n\n## Step 3: 验证 smoke 三件套（读 adapter_report.json）\n\n```bash\ncat <session_dir>/adapter_report.json\n```\n\n检查 `smoke_result.train_ok / export_ok / latency_ok` 全 true。任一为 false → fail loud。\n\n## 输出（ScoutResult schema，扁平结构）\n\n从 state.outputs 5 个 setup 节点拼路径，从 state.outputs.project_analyzer 拿 epochs_*：\n\n```json\n{\n  \"summary\": \"scout done: domain=<X>, baseline_T=<sec>, max_tier=<N>, primary=<metric>, adapter_smoke=ok\",\n  \"working_dir\": \"<abs>\",\n  \"session_dir\": \"<abs>\",\n  \"session_id\": \"<id>\",\n  \"workflow_dir\": \"<abs>\",\n  \"helpers_dir\": \"<abs>\",\n  \"adapter_path\": \"<state.outputs.adapter_generator.adapter_path>\",\n  \"project_analysis_path\": \"<session_dir>/project_analysis.json\",\n  \"epochs_controllable\": <from state.outputs.project_analyzer>,\n  \"epochs_default\": <from state.outputs.project_analyzer>,\n  \"adapter_report_path\": \"<state.outputs.adapter_generator.adapter_report_path>\",\n  \"baseline_path\": \"<state.outputs.baseline_runner.baseline_path>\",\n  \"budget_path\": \"<state.outputs.tier_planner.budget_path>\",\n  \"metrics_path\": \"<state.outputs.metrics_identifier.metrics_path>\",\n  \"domain_insights_path\": \"<state.outputs.domain_analyzer.domain_insights_path>\"\n}\n```\n\n## 严禁\n\n- ❌ issue sub_agent（5 个 setup 节点已迁到 DAG 顶层）\n- ❌ 用 helper 重写 baseline.json / budget.json（setup 节点自己已调 helper）\n- ❌ 触发 ask_user（cycle 非交互原则从 setup collector 开始）\n- ❌ 自己跑训练 / 直接调 train.py（必须走 _nas_adapter.py，由 baseline_runner 已完成）\n- ❌ 自己构造 session_dir 路径（必须用 init_session.py 输出）\n- ❌ 输出 `details` wrapper 或额外字段（框架强制 ScoutResult schema）\n- ❌ 静默吞错（任何文件缺失都要 fail loud 写到 summary）\n\n## Output Format\nUse tools freely. Before each tool call, briefly state what you intend to do and why.\nWhen finished, respond with JSON matching this schema (no markdown fences):\n{\n  \"properties\": {\n    \"summary\": {\n      \"type\": \"string\"\n    },\n    \"working_dir\": {\n      \"type\": \"string\"\n    },\n    \"session_dir\": {\n      \"type\": \"string\"\n    },\n    \"session_id\": {\n      \"type\": \"string\"\n    },\n    \"workflow_dir\": {\n      \"type\": \"string\"\n    },\n    \"helpers_dir\": {\n      \"type\": \"string\"\n    },\n    \"adapter_path\": {\n      \"description\": \"Absolute path to <working_dir>/_nas_adapter.py\",\n      \"type\": \"string\"\n    },\n    \"project_analysis_path\": {\n      \"description\": \"Absolute path to <session_dir>/project_analysis.json\",\n      \"type\": \"string\"\n    },\n    \"epochs_controllable\": {\n      \"type\": \"boolean\"\n    },\n    \"epochs_default\": {\n      \"type\": \"integer | null\"\n    },\n    \"adapter_report_path\": {\n      \"type\": \"string\"\n    },\n    \"baseline_path\": {\n      \"type\": \"string\"\n    },\n    \"budget_path\": {\n      \"type\": \"string\"\n    },\n    \"metrics_path\": {\n      \"type\": \"string\"\n    },\n    \"domain_insights_path\": {\n      \"type\": \"string\"\n    }\n  },\n  \"required\": [\n    \"summary\",\n    \"working_dir\",\n    \"session_dir\",\n    \"session_id\",\n    \"workflow_dir\",\n    \"helpers_dir\",\n    \"adapter_path\",\n    \"project_analysis_path\",\n    \"epochs_controllable\",\n    \"adapter_report_path\",\n    \"baseline_path\",\n    \"budget_path\",\n    \"metrics_path\",\n    \"domain_insights_path\"\n  ],\n  \"type\": \"object\"\n}","output":{"summary":"scout failed: missing files in session_dir /Users/mozzie/Desktop/Projects/AgentHarness/workflows/nas/runs/20260617_074559_microxcaling — project_analysis.json, adapter_report.json, baseline_eval.json, baseline_profile.json, baseline.json, budget.json, metrics.json, domain_insights.md (8/9 key files missing; only _nas_adapter.py exists in working_dir). Setup nodes (baseline_runner, tier_planner, metrics_identifier) have not yet written outputs for this session.","working_dir":"/Users/mozzie/Desktop/Projects/Analyser/microxcaling","session_dir":"/Users/mozzie/Desktop/Projects/AgentHarness/workflows/nas/runs/20260617_074559_microxcaling","session_id":"20260617_074559_microxcaling","workflow_dir":"/Users/mozzie/Desktop/Projects/AgentHarness/workflows/nas","helpers_dir":"/Users/mozzie/Desktop/Projects/AgentHarness/workflows/nas/helpers","adapter_path":"/Users/mozzie/Desktop/Projects/Analyser/microxcaling/_nas_adapter.py","project_analysis_path":"/Users/mozzie/Desktop/Projects/AgentHarness/workflows/nas/runs/20260617_074559_microxcaling/project_analysis.json","epochs_controllable":true,"epochs_default":null,"adapter_report_path":"/Users/mozzie/Desktop/Projects/AgentHarness/workflows/nas/runs/20260617_074559_microxcaling/adapter_report.json","baseline_path":"/Users/mozzie/Desktop/Projects/AgentHarness/workflows/nas/runs/20260617_074559_microxcaling/baseline.json","budget_path":"/Users/mozzie/Desktop/Projects/AgentHarness/workflows/nas/runs/20260617_074559_microxcaling/budget.json","metrics_path":"/Users/mozzie/Desktop/Projects/AgentHarness/workflows/nas/runs/20260617_074559_microxcaling/metrics.json","domain_insights_path":"/Users/mozzie/Desktop/Projects/AgentHarness/workflows/nas/runs/20260617_074559_microxcaling/domain_insights.md"},"summary":"scout failed: missing files in session_dir /Users/mozzie/Desktop/Projects/AgentHarness/workflows/nas/runs/20260617_07455…"}